"Gender not selected", "Genre non sélectionné"
"Birthday not selected", "Anniversaire non sélectionné"
"Birthday is invalid", "Anniversaire non valide"
"Provided date is not valid", "La date fournie n'est pas valide"
"Internal invoice (InvoiceObserver) error", "Erreur de facture interne (InvoiceObserver)"
"Invalid payment plan", "Plan de paiement non valide"
"Please select installment send way", "S'il vous plaît sélectionnez le mode de livraison d'acompte"
"Invoice send way invalid address", "Invoice send way invalid address"